{
  "$schema": "https://json-schema.org/draft/2020-12/schema",
  "title": "Owlshift result.json",
  "description": "The result of one run, written by the role as `result.json`.\n\nBeyond this schema, the runner also requires question ids to be Q1, Q2, …\nQn in order; verdicts in increasing question order, each with a reason\nthat is not only whitespace and, on a counter-question and nowhere else,\na reply that is not either; resolutions in increasing question order; and,\nagainst the run's brief, verdicts from the answer check only, covering\nexactly its latest ask, resolutions from the resolver only, covering\nexactly the questions it was given, no decisions from the build role,\nno `done` from a Build run told that its predecessor's decisions were\nrefused, from such a run when it asks, every refused choice of its\nbrief named in `refused_choices_asked` (OWL-193), and `intake` from the\nintake role only, which gives it whenever it ends `done` or `questions`\n(OWL-245).",
  "type": "object",
  "properties": {
    "artifacts": {
      "description": "Paths, relative to the worktree, of the artifacts the run left.",
      "$ref": "#/$defs/Artifacts",
      "default": {}
    },
    "decisions": {
      "description": "Decisions a role took without a human. No role fills it today: the\nbuild role takes none of its own and asks instead, so a build result\nlisting one is refused (OWL-176); the answer check and the resolver\nare told to leave it out, the resolver's decisions being its\n`resolutions`.",
      "type": "array",
      "default": [],
      "items": {
        "$ref": "#/$defs/Decision"
      }
    },
    "followups": {
      "description": "Follow-up tickets proposed to a human; never admitted automatically.",
      "type": "array",
      "default": [],
      "items": {
        "$ref": "#/$defs/Followup"
      }
    },
    "format": {
      "description": "The format version of this document.",
      "type": "integer",
      "const": 8
    },
    "intake": {
      "description": "The intake role's record (format 8, OWL-245): required from it when\nit ends `done` or `questions`, refused with any other status and from\nany other role.",
      "anyOf": [
        {
          "$ref": "#/$defs/IntakeVerdict"
        },
        {
          "type": "null"
        }
      ]
    },
    "pr": {
      "description": "The pull request to open; only with `status: done`.",
      "anyOf": [
        {
          "$ref": "#/$defs/PullRequest"
        },
        {
          "type": "null"
        }
      ],
      "default": null
    },
    "questions": {
      "description": "Questions for the decider, numbered Q1..Qn; at least one when `status`\nis `questions`.",
      "type": "array",
      "default": [],
      "items": {
        "$ref": "#/$defs/Question"
      }
    },
    "refused_choices_asked": {
      "description": "For each choice of the brief's `refused_choices`, by its place from\n1, the question of this result that asks it (OWL-193): every place,\nin order, when a Build run told of refused choices asks. Only in a\nresult that asks ([`RunResult::asks`]), and only when the brief gives\nrefused choices.",
      "type": "array",
      "items": {
        "$ref": "#/$defs/RefusedChoiceAsked"
      }
    },
    "resolutions": {
      "description": "The resolver's outcome on each question of its brief's `resolve`, in\nquestion order; only from the resolver, and only with `status: done`.",
      "type": "array",
      "default": [],
      "items": {
        "$ref": "#/$defs/Resolution"
      }
    },
    "status": {
      "$ref": "#/$defs/Status"
    },
    "summary": {
      "description": "One or two sentences on what the run did.",
      "type": "string"
    },
    "verdicts": {
      "description": "The answer check's verdict on each question of the latest ask, in\nquestion order; only from the answer check, and only with `status:\ndone`.",
      "type": "array",
      "default": [],
      "items": {
        "$ref": "#/$defs/Verdict"
      }
    }
  },
  "additionalProperties": false,
  "allOf": [
    {
      "if": {
        "properties": {
          "status": {
            "const": "questions"
          }
        },
        "required": [
          "status"
        ]
      },
      "then": {
        "properties": {
          "questions": {
            "minItems": 1
          }
        },
        "required": [
          "questions"
        ]
      }
    },
    {
      "if": {
        "properties": {
          "pr": {
            "type": "object"
          }
        },
        "required": [
          "pr"
        ]
      },
      "then": {
        "properties": {
          "status": {
            "const": "done"
          }
        }
      }
    },
    {
      "if": {
        "properties": {
          "verdicts": {
            "minItems": 1
          }
        },
        "required": [
          "verdicts"
        ]
      },
      "then": {
        "properties": {
          "status": {
            "const": "done"
          }
        }
      }
    },
    {
      "if": {
        "properties": {
          "resolutions": {
            "minItems": 1
          }
        },
        "required": [
          "resolutions"
        ]
      },
      "then": {
        "properties": {
          "status": {
            "const": "done"
          }
        }
      }
    },
    {
      "if": {
        "properties": {
          "refused_choices_asked": {
            "minItems": 1
          }
        },
        "required": [
          "refused_choices_asked"
        ]
      },
      "then": {
        "properties": {
          "questions": {
            "minItems": 1
          },
          "status": {
            "enum": [
              "questions",
              "premise_false"
            ]
          }
        },
        "required": [
          "questions"
        ]
      }
    },
    {
      "if": {
        "properties": {
          "intake": {
            "type": "object"
          }
        },
        "required": [
          "intake"
        ]
      },
      "then": {
        "properties": {
          "status": {
            "enum": [
              "done",
              "questions"
            ]
          }
        }
      }
    }
  ],
  "required": [
    "format",
    "status",
    "summary"
  ],
  "$defs": {
    "AnswerClass": {
      "description": "How the decider's answers left one question.",
      "oneOf": [
        {
          "description": "The answers settle the question.",
          "type": "string",
          "const": "answered"
        },
        {
          "description": "The answers settle part of the question; the rest is missing.",
          "type": "string",
          "const": "partial"
        },
        {
          "description": "No answer from the decider addresses the question.",
          "type": "string",
          "const": "unanswered"
        },
        {
          "description": "The decider answered with a question of their own.",
          "type": "string",
          "const": "counter_question"
        }
      ]
    },
    "Artifacts": {
      "description": "Artifacts left by the run, as paths relative to the worktree that cannot\nleave it. Their content formats are defined by the roles that write them.",
      "type": "object",
      "properties": {
        "findings": {
          "anyOf": [
            {
              "$ref": "#/$defs/RelativePath"
            },
            {
              "type": "null"
            }
          ]
        },
        "ledger": {
          "anyOf": [
            {
              "$ref": "#/$defs/RelativePath"
            },
            {
              "type": "null"
            }
          ]
        },
        "plan": {
          "anyOf": [
            {
              "$ref": "#/$defs/RelativePath"
            },
            {
              "type": "null"
            }
          ]
        },
        "report": {
          "anyOf": [
            {
              "$ref": "#/$defs/RelativePath"
            },
            {
              "type": "null"
            }
          ]
        }
      },
      "additionalProperties": false
    },
    "Decision": {
      "description": "A decision the role took on its own.",
      "type": "object",
      "properties": {
        "basis": {
          "description": "What the decision rests on: the ticket, the code, the docs, a fact.",
          "type": "string"
        },
        "decision": {
          "type": "string"
        },
        "question": {
          "type": "string"
        }
      },
      "additionalProperties": false,
      "required": [
        "question",
        "decision",
        "basis"
      ]
    },
    "Effort": {
      "description": "How hard a model thinks, as `claude --effort` names its levels (checked\non 2026-10-13 with Claude Code 2.1.296: `claude --help` lists `low`,\n`medium`, `high`, `xhigh` and `max`). A harness with other levels maps\nfrom these when routing follows the verdict (P5).",
      "type": "string",
      "enum": [
        "low",
        "medium",
        "high",
        "xhigh",
        "max"
      ]
    },
    "Followup": {
      "description": "A follow-up ticket proposed to a human.",
      "type": "object",
      "properties": {
        "blocked_by_parent": {
          "description": "Whether the follow-up waits for the current ticket to be done.",
          "type": "boolean",
          "default": false
        },
        "done_when": {
          "description": "When the follow-up counts as done.",
          "type": "string"
        },
        "evidence": {
          "type": "array",
          "default": [],
          "items": {
            "type": "string"
          }
        },
        "source": {
          "$ref": "#/$defs/FollowupSource"
        },
        "title": {
          "type": "string"
        },
        "why": {
          "type": "string"
        }
      },
      "additionalProperties": false,
      "required": [
        "title",
        "why",
        "source",
        "done_when"
      ]
    },
    "FollowupSource": {
      "description": "Who found the follow-up.",
      "type": "string",
      "enum": [
        "agent",
        "reviewer",
        "ci"
      ]
    },
    "Harness": {
      "description": "A harness: a vendor CLI that runs one role headless.",
      "type": "string",
      "enum": [
        "claude",
        "codex"
      ]
    },
    "IntakeDependency": {
      "description": "A ticket the intake role found this one depends on: its identifier and\nthe words of the ticket that name it, not blank, on one line and at most\n[`MAX_QUOTE_BYTES`].",
      "type": "object",
      "properties": {
        "quote": {
          "type": "string",
          "pattern": "\\S"
        },
        "ticket": {
          "$ref": "#/$defs/TicketId"
        }
      },
      "additionalProperties": false,
      "required": [
        "ticket",
        "quote"
      ]
    },
    "IntakeVerdict": {
      "description": "What the intake role found on a ticket (architecture section 5,\n\"Intake\"): its pipeline variant, its routing verdict and the tickets it\ndepends on. In P4 the verdict is recorded and shown, and the Build runs\nas `do`'s does; per-ticket routing follows it from P5.",
      "type": "object",
      "properties": {
        "dependencies": {
          "description": "The tickets this one depends on, each named by its identifier in the\nticket's text or thread; at most [`MAX_DEPENDENCIES`]. A dependency\nnamed without an identifier is a question, never a guess.",
          "type": "array",
          "default": [],
          "items": {
            "$ref": "#/$defs/IntakeDependency"
          },
          "maxItems": 64
        },
        "routing": {
          "$ref": "#/$defs/Routing"
        },
        "variant": {
          "$ref": "#/$defs/Variant"
        }
      },
      "additionalProperties": false,
      "required": [
        "variant",
        "routing"
      ]
    },
    "PullRequest": {
      "description": "The pull request the runner opens for a finished ticket.",
      "type": "object",
      "properties": {
        "body": {
          "type": "string"
        },
        "branch": {
          "type": "string"
        },
        "title": {
          "type": "string"
        }
      },
      "additionalProperties": false,
      "required": [
        "branch",
        "title",
        "body"
      ]
    },
    "Question": {
      "description": "A question for the decider, understandable without any transcript.",
      "type": "object",
      "properties": {
        "category": {
          "description": "What the question is about, such as `scope` or `security`.",
          "type": "string"
        },
        "context": {
          "description": "What the reader needs to know to answer.",
          "type": "string"
        },
        "id": {
          "$ref": "#/$defs/QuestionId"
        },
        "options": {
          "type": "array",
          "default": [],
          "items": {
            "type": "string"
          }
        },
        "recommendation": {
          "type": [
            "string",
            "null"
          ]
        },
        "text": {
          "type": "string"
        }
      },
      "additionalProperties": false,
      "required": [
        "id",
        "category",
        "context",
        "text"
      ]
    },
    "QuestionId": {
      "description": "A question's identifier within a round: Q1, Q2, and so on.",
      "type": "string",
      "pattern": "^Q[1-9][0-9]*$"
    },
    "RefusedChoiceAsked": {
      "description": "Where a Build run told of refused choices asks one of them (OWL-193):\nthe choice's place in its brief's `refused_choices`, from 1, and the id\nof the question of the same result that asks it. Several choices may\nname one question.",
      "type": "object",
      "properties": {
        "choice": {
          "type": "integer",
          "format": "uint32",
          "minimum": 1
        },
        "question": {
          "$ref": "#/$defs/QuestionId"
        }
      },
      "additionalProperties": false,
      "required": [
        "choice",
        "question"
      ]
    },
    "RelativePath": {
      "description": "A path relative to the worktree: '/'-separated segments, none empty or '..', with no backslash or colon.",
      "type": "string",
      "pattern": "^(?:[^/\\\\:.][^/\\\\:]*|\\.(?:[^/\\\\:.][^/\\\\:]*)?|\\.\\.[^/\\\\:]+)(?:/(?:[^/\\\\:.][^/\\\\:]*|\\.(?:[^/\\\\:.][^/\\\\:]*)?|\\.\\.[^/\\\\:]+))*$"
    },
    "Resolution": {
      "description": "The resolver's outcome on one question it was given: decided, with its\nown label for the question, the decision and what settles it, or passed\non to the decider, with why. Every text but the label is not empty and\nnot only whitespace; the runner judges the label.",
      "oneOf": [
        {
          "description": "Settled by what the ticket, the thread, the project's rules or the\nrepository already establish; the runner logs it on the ticket as a\nreversible decision.",
          "type": "object",
          "properties": {
            "basis": {
              "description": "What settles it: the ticket, a rule, a file, an earlier answer.",
              "type": "string",
              "pattern": "\\S"
            },
            "category": {
              "description": "The resolver's own label for the question, read from its text and\ncontext: a floor token when the question touches a floor topic.\nThe runner logs the decision only when this label is a token and\nit and the raising run's category both route to the resolver,\nand otherwise sends the question to the decider\n(`owlshift_core::gate::GatePolicy::route_decided`).",
              "type": "string"
            },
            "decision": {
              "type": "string",
              "pattern": "\\S"
            },
            "outcome": {
              "type": "string",
              "const": "decided"
            },
            "question": {
              "$ref": "#/$defs/QuestionId"
            }
          },
          "additionalProperties": false,
          "required": [
            "outcome",
            "question",
            "category",
            "decision",
            "basis"
          ]
        },
        {
          "description": "Not settled by anything the resolver may rely on: the question goes\nto the decider.",
          "type": "object",
          "properties": {
            "outcome": {
              "type": "string",
              "const": "passed_on"
            },
            "question": {
              "$ref": "#/$defs/QuestionId"
            },
            "reason": {
              "type": "string",
              "pattern": "\\S"
            }
          },
          "additionalProperties": false,
          "required": [
            "outcome",
            "question",
            "reason"
          ]
        }
      ]
    },
    "Routing": {
      "description": "The routing verdict: the harness, tier and effort of the ticket's runs\n(section 9, \"One routing verdict per ticket\").",
      "type": "object",
      "properties": {
        "effort": {
          "$ref": "#/$defs/Effort"
        },
        "harness": {
          "$ref": "#/$defs/Harness"
        },
        "tier": {
          "$ref": "#/$defs/Tier"
        }
      },
      "additionalProperties": false,
      "required": [
        "harness",
        "tier",
        "effort"
      ]
    },
    "Status": {
      "description": "How a run ended.",
      "type": "string",
      "enum": [
        "done",
        "questions",
        "blocked",
        "premise_false",
        "failed"
      ]
    },
    "TicketId": {
      "description": "A tracker's ticket identifier, safe as a git ref component and a file name.",
      "type": "string",
      "pattern": "^[A-Za-z0-9][A-Za-z0-9_-]{0,63}$"
    },
    "Tier": {
      "description": "A model tier; the configuration maps each tier to a model per harness.",
      "type": "string",
      "enum": [
        "deep",
        "standard",
        "fast"
      ]
    },
    "Variant": {
      "description": "A pipeline variant.",
      "type": "string",
      "enum": [
        "trivial",
        "standard",
        "risky"
      ]
    },
    "Verdict": {
      "description": "The answer check's verdict on one question: how the decider's answers\nleft it.",
      "type": "object",
      "properties": {
        "class": {
          "$ref": "#/$defs/AnswerClass"
        },
        "question": {
          "$ref": "#/$defs/QuestionId"
        },
        "reason": {
          "description": "Why, from the answers: what settled the question, or what is still\nmissing. Not empty and not only whitespace.",
          "type": "string",
          "pattern": "\\S"
        },
        "reply": {
          "description": "The answer to the decider's counter-question, which the runner posts\nin the thread as written. Required with `class: counter_question`,\nrefused with any other class; not empty and not only whitespace.",
          "type": "string",
          "pattern": "\\S"
        }
      },
      "additionalProperties": false,
      "else": {
        "not": {
          "required": [
            "reply"
          ]
        }
      },
      "if": {
        "properties": {
          "class": {
            "const": "counter_question"
          }
        },
        "required": [
          "class"
        ]
      },
      "required": [
        "question",
        "class",
        "reason"
      ],
      "then": {
        "required": [
          "reply"
        ]
      }
    }
  }
}
