{
  "format": 8,
  "status": "done",
  "summary": "The README lists every file at the root.",
  "resolutions": [
    {
      "question": "Q1",
      "category": "docs",
      "outcome": "decided",
      "decision": "Yes, in the README's list of files.",
      "basis": "README.md lists every file at the root."
    }
  ]
}
